{
  "$schema": "./schema/behavioral.schema.json",
  "rules": [
    "Answer the question directly, then give a specific Situation, Task, Action, and Result. Amazon recommends STAR; these rehearsal timings are practice choices, not interview rules.",
    "Practise a 90-second core answer, then expand for follow-up questions. Spend most of the answer on your own decisions and actions.",
    "Use I for your contribution and credit collaborators accurately. Never replace an unknown team boundary with sole ownership.",
    "Explain one choice, the alternative, and why you chose it. Mark unverified personal details [confirm: ...] until you can substantiate them.",
    "Use resume metrics with their baseline, measurement window, and limitations. Oracle dates are Jul 2022 to Jan 2025, approximately two and a half years.",
    "Build breadth across distinct episodes. S7 is another angle on S1; team adoption alone does not establish mentoring, disagreement, or failure.",
    "The user-supplied recruiter screenshot identifies the full-time AWSI-ETP Solutions Architect role: design AWS solutions for customer challenges, collaborate with sales, and adapt communication from technical experts to executives. Frame success as positive customer impact; confirm personal experience before implying you have done each responsibility."
  ],
  "status_options": [
    {
      "id": "draft",
      "label": "Draft"
    },
    {
      "id": "rehearsing",
      "label": "Rehearsing"
    },
    {
      "id": "ready",
      "label": "Ready"
    }
  ],
  "pitch": {
    "target_sec": 60,
    "beats": [
      {
        "label": "Who",
        "text": "I'm Anuvik, an MS computer science student at USC, graduating in December 2026. At Oracle from July 2022 to January 2025, I worked on observability, incident diagnostics, and Kubernetes for enterprise services."
      },
      {
        "label": "Proof",
        "text": "One project instrumented real-time API diagnostics and helped reduce P1 MTTR from 94 to 26 minutes by giving on-call engineers root-cause tags and runbook context."
      },
      {
        "label": "Customer",
        "text": "At MSRcosmos, I worked on multi-agent ERP migration with human review across 12 client entities. The reported turnaround went from 3 days to 5.5 hours."
      },
      {
        "label": "Why SA",
        "text": "Proposed motivation: I want to apply my operational and AI engineering experience to customer challenges in the AWSI-ETP Solutions Architect role: compare AWS designs, collaborate with sales on customer context, and make the recommendation clear to engineers and executives. [confirm: your authentic motivation and why AWS]"
      }
    ],
    "closing_line": "Proposed close: I want to be measured by the positive impact the architecture has for the customer. [confirm: phrase this in your own words and support it with a real example]"
  },
  "lps": [
    {
      "id": "customer-obsession",
      "name": "Customer Obsession",
      "meaning": "Start with the customer and work backwards; earn and keep their trust.",
      "primary": "erp-hitl",
      "backup": "pacsun-exec"
    },
    {
      "id": "ownership",
      "name": "Ownership",
      "meaning": "Act on behalf of the whole company and the long term; never say that is not my job.",
      "primary": "erp-hitl",
      "backup": "p1-mttr"
    },
    {
      "id": "invent-and-simplify",
      "name": "Invent and Simplify",
      "meaning": "Expect and find new ways; make the complex simple.",
      "primary": "cli-toolchain",
      "backup": "trust-hitl"
    },
    {
      "id": "are-right-a-lot",
      "name": "Are Right, A Lot",
      "meaning": "Strong judgment and good instincts; seek diverse views and try to disprove your own beliefs.",
      "primary": "slo-alerting",
      "backup": "modelscope"
    },
    {
      "id": "learn-and-be-curious",
      "name": "Learn and Be Curious",
      "meaning": "Never done learning; explore new possibilities.",
      "primary": "learn-langgraph",
      "backup": "modelscope"
    },
    {
      "id": "hire-and-develop",
      "name": "Hire and Develop the Best",
      "meaning": "Raise the bar and help other people grow.",
      "primary": "cli-toolchain",
      "backup": null,
      "gap": "mentoring"
    },
    {
      "id": "highest-standards",
      "name": "Insist on the Highest Standards",
      "meaning": "Keep raising the bar; do not pass defects downstream.",
      "primary": "erp-hitl",
      "backup": "k8s-autoscaling"
    },
    {
      "id": "think-big",
      "name": "Think Big",
      "meaning": "Set a bold direction that inspires results.",
      "primary": "pacsun-exec",
      "backup": "p1-mttr"
    },
    {
      "id": "bias-for-action",
      "name": "Bias for Action",
      "meaning": "Speed matters; many decisions are reversible, so take calculated risks.",
      "primary": "p1-mttr",
      "backup": "dqn-stall"
    },
    {
      "id": "frugality",
      "name": "Frugality",
      "meaning": "Accomplish more with less; constraints breed invention.",
      "primary": "modelscope",
      "backup": "netsuite-latency"
    },
    {
      "id": "earn-trust",
      "name": "Earn Trust",
      "meaning": "Listen, speak candidly, admit mistakes, and treat others respectfully.",
      "primary": "erp-hitl",
      "backup": "cli-toolchain"
    },
    {
      "id": "dive-deep",
      "name": "Dive Deep",
      "meaning": "Stay connected to the details; no task is beneath you.",
      "primary": "netsuite-latency",
      "backup": "dqn-stall"
    },
    {
      "id": "have-backbone",
      "name": "Have Backbone; Disagree and Commit",
      "meaning": "Challenge decisions respectfully, then commit fully once decided.",
      "primary": null,
      "backup": null,
      "gap": "disagreement"
    },
    {
      "id": "deliver-results",
      "name": "Deliver Results",
      "meaning": "Focus on the key inputs and deliver them with quality and on time.",
      "primary": "p1-mttr",
      "backup": "databricks-feed",
      "gap": "failure"
    },
    {
      "id": "best-employer",
      "name": "Strive to be Earth's Best Employer",
      "meaning": "Make the work environment safer, more productive, and more fulfilling for people.",
      "primary": "cli-toolchain",
      "backup": "slo-alerting"
    },
    {
      "id": "broad-responsibility",
      "name": "Success and Scale Bring Broad Responsibility",
      "meaning": "Think about second-order effects on people and society; act responsibly.",
      "primary": "trust-hitl",
      "backup": "erp-hitl"
    }
  ],
  "gaps": [
    {
      "id": "failure",
      "name": "Failure or mistake",
      "lps": [
        "deliver-results",
        "earn-trust",
        "are-right-a-lot"
      ],
      "asked_as": [
        "Tell me about a time you failed.",
        "A time you missed a deadline.",
        "A time your judgment was wrong."
      ],
      "seeds": "Look at Oracle deploys before the CLI toolchain existed, or an early MSRcosmos agent run that produced a wrong result.",
      "template": {
        "s": "What did I own that went wrong, and who felt it?",
        "t": "What was I on the hook for when it broke?",
        "a": "What did I do in the first hour, and what did I change so it could not repeat the same way?",
        "r": "The fix, a number if there is one, and the one habit I kept. End on the lesson, not the excuse."
      }
    },
    {
      "id": "disagreement",
      "name": "Disagreement (Have Backbone)",
      "lps": [
        "have-backbone"
      ],
      "asked_as": [
        "Tell me about a time you disagreed with your manager.",
        "A time you disagreed with a customer.",
        "A time you committed to a decision you disagreed with."
      ],
      "seeds": "Build from S3 (moving alerts from static thresholds to SLOs) or S4 (a team resisting the CLI validation gate). Use a real disagreement only.",
      "template": {
        "s": "Who did I disagree with, about which technical decision?",
        "t": "What was at stake, and who owned the decision?",
        "a": "How did I understand their view first, what data did I bring, and how was it decided?",
        "r": "What shipped. If I lost, how I committed fully anyway. What I learned about disagreeing well."
      }
    },
    {
      "id": "mentoring",
      "name": "Mentoring (Hire and Develop)",
      "lps": [
        "hire-and-develop"
      ],
      "asked_as": [
        "Tell me about a time you helped someone grow.",
        "How have you raised the bar on your team?"
      ],
      "seeds": "A new teammate, a lab member, an on-call engineer using your runbooks, or an engineer on one of the 4 teams adopting the CLI toolchain.",
      "template": {
        "s": "Who did I help ramp up, and where were they starting from?",
        "t": "What did they need to be able to do, and by when?",
        "a": "How did I teach it: pairing, docs, reviews? One specific thing I did.",
        "r": "What they could do on their own afterward. A concrete outcome."
      }
    }
  ],
  "stories": [
    {
      "id": "erp-hitl",
      "code": "S1",
      "title": "Multi-agent ERP migration with human-in-the-loop",
      "experience_id": "msrcosmos",
      "lead": true,
      "lps": [
        "customer-obsession",
        "ownership",
        "earn-trust",
        "highest-standards",
        "broad-responsibility"
      ],
      "number_ids": [
        "msr-records",
        "msr-entities",
        "msr-cycle-before",
        "msr-cycle-after",
        "msr-reconciliation",
        "msr-auto-approved"
      ],
      "headline": "I built human-review routing for an ERP migration across 12 entities; reported turnaround fell from 3 days to 5.5 hours.",
      "s": "At MSRcosmos, the migration moved 10,000+ GL/AP/AR records from Sage X3 to Sage Intacct across 12 client entities. [confirm: who was affected by reconciliation delays and the actual business deadline]",